	doc_id	label	text
731	732	Persuasive	That whole Nazi bullshit is really making me think twice about who the U.S is helping out there. Let them play out their historical conflict and stay out.
994	995	Humorous	Putin and his Paper Gun Army
910	911	Humorous	Pica is fucking weird
488	489	Support/Disapproval	Fuck you Putin! We don't negotiate with terrorists. It's the scorpion and the frog story all over again
788	789	Humorous	It's Friday, and you're not wearing pink!you can't sit with us
341	342	Persuasive	Surprised Russia remembers we exist...
91	92	Support/Disapproval	Yeah no shot. Screw their intentions
897	898	Humorous	If I was married in China I'd be a bit nervous right now
931	932	Inquiry	why not alla helping them in any form?
164	165	Humorous	....by launching nukes as a blanket assault to remove the nazis hidden in the dark like Sauron??
732	733	Informational	The Iranian gov is very far from being a representative of Islamic law. The Iranian constitution has, in a lot of situations, directly broke baaic Islamic rules. You are more than welcomed to critique this action of prosecution, but blame it on the appropriate party: the Iranian gov and not Islam as a religion or as a spurce of law.
102	103	Humorous	Welcome to WW3 everyone we gotta special one this time for you. Players are already choosing a side! In the right corner we have the bloated oligarch crime syndicates and in the left we have the corporate kleptocrats. We are looking forward to the last round NUCLEAR SHOWDOWN.
282	283	Persuasive	Mexico is hosting its own civil war that its president is unable to manage.
883	884	Informational	This is not even the first time the Russians tried to wipe out the Ukrainians. Google Holomodor. 1932-33. 1/3 of the country deliberately starved to death by Stalin.
495	496	Persuasive	Ya gotta give
787	788	Persuasive	All Russia need to do is go home. That's it.    I don't know how or why Mexico is in Putin's pocket, but there is no excuse for anything but Russians simply going home to their families.
968	969	Persuasive	The CCP will never - ever - be able to take Taiwan back with force.  Compare this with DDay in WWII.  The coast of France is 50 miles across the English Channel from the UK.  Taiwan is more than twice as far from Mainland China.  In DDay the Allie's had the element of surprise.  With China, we will know from satellites the minute they begin to amass any force at all. In DDay the Luftwaffe - Germanys Air Force - was nonexistent after the fight w Russia.  With Taiwan, they have a substantive and modern Air Force and air defense system.  In DDay, the Allie's were invading a willing territory of France under resistance that could provide support.  The Taiwanese have been preparing to defend the island for 70 years.  In DDay the attacking forces were already battle tested, both from experience in WWI and WWII. The Chinese have not been in a war, especially where they had to attack someone — ever.  The Chinese have no blue water Navy to consolidate their attack on Taiwan — they have 2 used air craft carriers from Russia.  The US alone has 15 super carriers capable of operating anywhere in the world.  The list goes on.  The Chinese would need more than 2 million troops to land on Taiwan, take it and keep it.  DDay, as big as it was, sent 156,000.
513	514	Persuasive	All those right wingers are apparently so insecure about their repressed sexuality that they feel the need to fight.
518	519	Persuasive	He seems a little desperate
437	438	Support/Disapproval	That plan will only benefit Russia.   Why should Ukraine accept a ceasefire where millions of people are under Russia's jurisdiction, when they are on land recognized by the international community to be part of Ukraine.   The fact that Mexico won't do any sanctions on Russia tells us everything on where they stand in this conflict. They are morally bankrupt.
244	245	Informational	"This is the best tl;dr I could make, [original](https://english.alaraby.co.uk/news/egypt-raise-suez-canal-transit-fees-ships-2023) reduced by 65%. (I'm a bot) ***** &gt; Egypt said on Saturday that it will increase transit fees for vessels, including oil-laden tankers, passing through Suez Canal, one of the world&amp;#039;s most crucial waterways.  &gt; The Suez Canal Authority said in a statement on Saturday that it will add 15 percent to the fees for tankers carrying oil and petroleum products, and 10 percent for dry bulk carriers and cruise ships.  &gt; Canal authorities have been working to widen and deepen the waterway&amp;#039;s southern part, since a hulking vessel ran aground and closed off the canal in March 2021.   ***** [**Extended Summary**](http://np.reddit.com/r/autotldr/comments/xh8n0r/egypt_to_raise_suez_canal_transit_fees_for_ships/) | [FAQ](http://np.reddit.com/r/autotldr/comments/31b9fm/faq_autotldr_bot/ ""Version 2.02, ~669605 tl;drs so far."") | [Feedback](http://np.reddit.com/message/compose?to=%23autotldr ""PM's and comments are monitored, constructive feedback is welcome."") | *Top* *keywords*: **Canal**^#1 **percent**^#2 **vessel**^#3 **Authority**^#4 **waterway**^#5"
483	484	Humorous	Let us not do that until he is dead. Let us wear thick jumpers and hats and laugh at him
30	31	Support/Disapproval	You would think Mexico and it's history of being invaded by an European power and its neighbor up north fucking with it just because it could, you would think they would understand better.
184	185	Humorous	Yay my 401k
578	579	Support/Disapproval	Russian warmonger - go fuck yourself.
980	981	Persuasive	War will definitely leave Taiwan in ruins....
932	933	Informational	&gt;Russia's invasion of Ukraine and a global food crisis aggravated by the war will be the focus of world leaders when they convene at the United Nations in New York this week, a gathering that is unlikely to yield any progress towards ending the conflict.        Climate change, Iran sanctions, and worsening global poverty will also feature at the annual meeting of world leaders in New York this week.
663	664	Humorous	"*""We'll hire you""*  \- Tesla R&amp;D Team"
915	916	Informational	But it also gives Ukraine/US time to beef up the defense force too.
98	99	Inquiry	Why the hell does anyone care what Mexico thinks about this?
645	646	Persuasive	AMLO has one on one meetings with Chomsky. He knows world geopolitics more than you know. Russia wrongly invaded a weaker country, much like the US invaded Mexico during the world war. Unlike the Ukraine, Mexico did not have wealthy and powerful allies to fight the more equipped US forces. Mexico is trying avoid a 3rd world war and also having Russia save face.
632	633	Humorous	"Americans who have been busy dealing with their own shit: ""what???"""
743	744	Informational	&gt;Putin's week: 1st Guards Tank Army destroyed, 101-7 at UNGA vote vs Russian bid to block Zelensky video address, Moscow Ferris Wheel broke down first day, humiliation at the hands of his “friends” in Samarkand, viral video of Wagner recruiting convicts, Izium murders exposed.  https://twitter.com/general_ben/status/1571215204033110016
327	328	Persuasive	Lol no wonder China supported Kyrgystan independence just a week earlier
474	475	Persuasive	Fiat currency is a mafia scam. Everything is money. The market chose gold and silver.
122	123	Informational	Europe is telling Putin, if he wants to talk to Europe First stop attacking Europe
649	650	Persuasive	$5 says some mystical delusions and/or religion have something to do with her doing this...
978	979	Persuasive	" ""What goes around, comes around."""
840	841	Persuasive	So close to home, I hope everyone there is okay. I really hope everyone evacuated in time.
784	785	Inquiry	I thought Germany already cancelled NS2? I doubt NS2 happens if Germany isn't onboard
417	418	Informational	So, for everyone who's just reading the headlines again: These are top-notch weapons using the newest tech of which (IIIRC) none have been produced yet. They are being made to order, and Ukraine wants them for building up its armed forcs after the fact. The german government is not involved at all, besides authorising the sale.
985	986	Informational	Current analysts are basing [invasion scenarios](https://www.militarytimes.com/news/2022/08/12/in-think-tanks-taiwan-war-game-us-beats-china-at-high-cost/) on technological advances of the US and China in 2026 so the timeline lines up.
235	236	Persuasive	Probably Russians in sombreros anyway, I hope all this posturing from ‘outside' parties are just remnants of Stalin diplomacy. Next Cuba will propose removing rockets from Ukraine or Kissinger has a plan to give away other people s land.
502	503	Informational	They don't yet.
146	147	Inquiry	Maybe the US should help them reinstall the shah?
446	447	Persuasive	Yeah!they should do that.   !but nothing tangible will come of it if Russia wins!  ..so maybe for now, concentrate on keeping Ukraine well armed.
829	830	Humorous	I nominate this post as the one with the best comments
959	960	Persuasive	&gt;“The plan is not subject to adjustment,” Putin said.   this is how you lose at life and war
145	146	Support/Disapproval	Who gives a shit a about what Mexico has to say?... honestly on of the most corrupt countries in the world
822	823	Humorous	I bet she's ever ready...
139	140	Persuasive	Australia is too weak
636	637	Support/Disapproval	Europe to Putin: If you want Ukraine then go fuck yourself.
192	193	Persuasive	I think it is important we acknowledge this is not just oil companies and all of us. Our habits and daily activities fuel it.  It takes all of us to change it.  Little changes matter!  Drive a little less, conserve a little more.  Without major lifestyle changes by almost all of us, we are complicit.
866	867	Humorous	Thank god he's not protecting a sex offender. That would be terrible
321	322	Informational	China is also interested in developing Western China, which is as close to the Mediterranean as it is to the east coast of China.
734	735	Inquiry	Did they also worry about what could happen to the people in the Ukraine when all this started?
140	141	Humorous	Damn, it's almost like you need a healthy economy to wage war.
598	599	Inquiry	Please forgive me, the article doesn't explain, and I really need to understand: She was putting the dildo in backwards and  lost 55 batteries before she figured it out?
82	83	Persuasive	Putin is probably just tricking Ukraine into believing he is going to end the conflict in between them. Once they come into an agreement to end the war and Ukraine let's it's guard down, Putin's military will attack them unexpectedly. You do not trust nor negotiate with terrorist.
179	180	Persuasive	"Sadly, i've seen a lot of pro-russia news here in mexico youtube channels.   I find ironic anti-usa people i know, hate america becuase they ""stole"" us territories in the 1800s but at he same time go shoppin/vacationing to the US and put their savings in US banks."
173	174	Informational	With its successes in the conflict zone, Ukraine has fundamentally changed modern warfare, stated Admiral Rob Bauer, chairman of the NATO Military Committee.  https://twitter.com/nexta_tv/status/1571364874470522881?t=L_MRbLU2YzkxOyXJAk5pCw&amp;s=19
920	921	Inquiry	We'r talking about AAA or AA batteries?
25	26	Support/Disapproval	Fuck Putin obviously 🙄!
624	625	Persuasive	It is now over for Russia, any days now....
677	678	Persuasive	Honestly? Call his bluff and open it. He won't send more gas, but we'll have another perfect example of him being a liar and a crook.
927	928	Informational	"This is the best tl;dr I could make, [original](https://www.theguardian.com/world/2022/sep/18/beijing-backed-chinese-language-schools-in-uk-to-be-replaced-with-teachers-from-taiwan) reduced by 79%. (I'm a bot) ***** &gt; A group of cross-party MPs is in talks with Taiwan to provide Mandarin teachers to the UK as the government seeks to phase out Chinese state-linked Confucius Institutes, the Observer has learned.  &gt; As bilateral relations between China and the UK continue to deteriorate, the Confucius language learning and teaching project has been under heavy scrutiny.  &gt; Considering how China can be included more in the existing syllabus at GCSE level and below - such as China&amp;#039;s role in the second world war, as well as looking at earlier parts of Asian history. At A-level and beyond, language should be taught based on experiences of people who have actually learned it, and not outsourced to anywhere - China, Taiwan or anywhere else.""   ***** [**Extended Summary**](http://np.reddit.com/r/autotldr/comments/xhcooi/beijingbacked_chinese_language_schools_in_uk_to/) | [FAQ](http://np.reddit.com/r/autotldr/comments/31b9fm/faq_autotldr_bot/ ""Version 2.02, ~669628 tl;drs so far."") | [Feedback](http://np.reddit.com/message/compose?to=%23autotldr ""PM's and comments are monitored, constructive feedback is welcome."") | *Top* *keywords*: **teach**^#1 **China**^#2 **language**^#3 **Chinese**^#4 **Mandarin**^#5"
971	972	Support/Disapproval	YES!!! ITS OVERDUE AND JUST!!! UKRAINE TAKE RUSSIA!!!
601	602	Humorous	The dam advertising budget is too damned high.
894	895	Persuasive	You can start by telling the PM not to be a fanny about letting her corporate masters walk all over the government.
318	319	Inquiry	Is that a message? That must be a message.
262	263	Humorous	Oh noooo! anyways.
264	265	Inquiry	Was the idea to crowd sourcing the peace deal? They may try on fiverr as well
342	343	Humorous	Iran wants a few more stuxnets in their asses or what?
473	474	Informational	all these companies that make weapons and vehicles for the US military are making BANK right now
169	170	Humorous	Probably a nice ride, sign me up!
366	367	Humorous	They have a few months at best XD
480	481	Humorous	Yeah, sure, but were they in series or parallel?
412	413	Humorous	Buying them to donate to the Ukrainians are they?  /s
141	142	Informational	This worries me a bit... Italy is having a hard time right now. Many industries and companies are closing because of the electricity bills going up to 4x. Unfortunately, over the years nobody wanted renewable/nuclear energy and we're now depending mostly on other countries. I fear that this news could cause protests from those who have lost their jobs or their business to ask to reopen the gas and return to being Russia's bit**es.  I am quite sure that willpower and moral principles are not a sufficient reason here.
360	361	Humorous	Holy ads batman
78	79	Support/Disapproval	I wish them the very best and hope this succeeds, but from what I know, Cheetahs never prosper
609	610	Humorous	Now i understand why she was always so full of energy.
157	158	Humorous	I have no idea what is going on over there...
461	462	Inquiry	Was she charged with battery?
284	285	Humorous	I was like why doesn't they just switch locations.....cuz I read that as NordVPN
20	21	Support/Disapproval	These neutral motherfuckers...
736	737	Humorous	The Nazis are invading Russia! It's World War 2 all over again!
232	233	Support/Disapproval	I can see how the Israelis and the Indians would be pissed right now.
926	927	Persuasive	Mexico❓‼️The land of cartels, kidnappings, corruption on an epic scale now wearing the cloak of peace brokering 🤷🏻‍♂️
945	946	Humorous	Светлая память настоящей Россиянке!
38	39	Inquiry	"&gt; The modern West has abolished all this, replacing it with virtual reality, extreme individualism, the destruction of sex, universal surveillance, a totalitarian “cancel culture”, and a post-truth society.  From the article Dugen recently wrote, the author of Foundation of Geopolitics.  Does anyone else ever get the feeling that a lot of the russian elite fell down the western right wing internet hole? Like the ""cancel culture"" and ""post-truth society"" thing are things I've seen on right wing english language boards long before russian's started talking about it."
379	380	Support/Disapproval	Well played Serbian police
653	654	Informational	President Zelenskyy UA warns Russian occupiers: We will strike harder than before.  https://twitter.com/pravda_eng/status/1571393605591146496?t=CjKUj-GQ4nA1wFHbG6TPug&amp;s=19
302	303	Persuasive	Send more HIMARS to Ukraine.
668	669	Humorous	Uno reverso card
275	276	Persuasive	I don't give a fuck about the monarchy and I really wish this pointless shit would stop taking up all the news headlines. It's 2022. We have SO MANY things more important to pay attention to than these wealthy do-nothings.
423	424	Informational	Average transit fee of just over $305,000 going up roughly $47,000.
909	910	Persuasive	I am leftist but this needed to happen. If you outright refuse to address some really big issues in the country this will happen.
117	118	Inquiry	Where the fuck did Mexico come from?
780	781	Humorous	And so it begins..
858	859	Humorous	Nah man. We're good
346	347	Persuasive	The media needs to stop encouraging people from doing stupid shit, like Guinness World Records.
188	189	Persuasive	"Everyone responding to the let's spend it here posts with ""Republicans won't do it"", who has the power right now to do these things but is instead spending it on other countries. You can't use that argument if they can and don't."
973	974	Persuasive	"The more EU tries with these little ""corrective measures"", the more Hungarians will turn to Orban/Putin side. Its similar to Serbia, you either make example of them or push them further with measures such as these."
938	939	Informational	Foreigners have the proper covid immunization. Not the Chinese 50% effectiveness vaccine. Foreigners are safer, and their countries are long over covid.
202	203	Support/Disapproval	I have fond memories of Belgrade from before the pandemic, cautiously but determinedly coming out of its shell.  Everyone was friendly (in their own way) and the gay night life seemed optimistic and growing in confidence.  I'm glad to see the people of Belgrade haven't lost that spirit.  Including their police.
588	589	Humorous	The hospital gotta discharge her at the end.
625	626	Humorous	Easiest Guinness world record ever. I'm off to the store for 14 six packs of battery, because that's the easiest math to get to 56 batteries where I can finally get some god damned attention.
614	615	Support/Disapproval	Dirty Mexicans
562	563	Inquiry	So...they bought 4?
6	7	Informational	"This is the best tl;dr I could make, [original](https://www.rferl.org/a/ukraine-kharkiv-liberated-settlements-vereshchuk/32038909.html) reduced by 87%. (I'm a bot) ***** &gt; &amp;quot;Violating the reached agreements, the Tajik side renewed gunfire at Kyrgyz border guards&amp;#039; positions in the settlements of Kulundu and Jany-Jer in the Leilek district,&amp;quot; the border service said, adding that the Tajik side used multiple rocket launchers against positions in the Batken district.  &gt; Border issues in Central Asia stem to a large extent from the Soviet era when Moscow tried to divide the region between ethnic groups whose settlements were often located amidst those of other ethnicities.  &gt; Kyrgyzstan&amp;#039;s southern Batken Province, which borders Tajikistan&amp;#039;s northern Sughd region and features a Tajik exclave, Vorukh, has been a key hotspot in recent conflicts.   ***** [**Extended Summary**](http://np.reddit.com/r/autotldr/comments/xh6gwe/ukraine_warns_people_against_rushing_back_to/) | [FAQ](http://np.reddit.com/r/autotldr/comments/31b9fm/faq_autotldr_bot/ ""Version 2.02, ~669603 tl;drs so far."") | [Feedback](http://np.reddit.com/message/compose?to=%23autotldr ""PM's and comments are monitored, constructive feedback is welcome."") | *Top* *keywords*: **border**^#1 **Kyrgyz**^#2 **Tajik**^#3 **side**^#4 **drone**^#5"
240	241	Support/Disapproval	Bullshit!!!
419	420	Persuasive	Over the next 50 years, some serious shit is gonna go down. The last 50 years have been pretty chill. But I'm fairly sure that's about to end.
993	994	Persuasive	No, they don't. Not even close
739	740	Humorous	Ka-ching!
891	892	Inquiry	By Green issues, do you fleecing all of England — lining his pockets?
359	360	Informational	I'm from Kyrgyzstan. The President of Tajikistan Emomali Rahmon transferred some part of his lands to China because of debts. to distract the people from this, he attacked the civilians of Kyrgyzstan and provoked a war. Now, Kyrgyzstan needs material and humanitarian assistance. many houses were burned, kindergartens, schools were destroyed, people were left without homes.
694	695	Persuasive	Yeah and what about Israel? Ohhh no wouldnt do that would she
210	211	Informational	Just in case you're wondering if russians have any honor left, here's an article about a papal representative getting shot while on a humanitarian mission in Ukraine  https://kyivindependent.com/uncategorized/papal-representative-comes-under-fire-near-ukraines-frontline-in-zaporizhzhia-oblast
615	616	Support/Disapproval	Don't call us, we'll call you.
629	630	Inquiry	Did anyone else actually read the article to see if she ate them or shoved them up her butt?
501	502	Humorous	1.21 jiggawatts! She is a time traveler clearly!
757	758	Informational	As a foreigner living in China this pleases me. I like getting a seat in the metro and prefer to take lifts alone.
101	102	Inquiry	If the senator from Mexico thinks that Russia has legitimate reason to be in Ukraine protecting Russians from the “Nazis” in Ukraine, Does the USA have a legit reason to invade and genocide the innocent Mexicans because of the drug cartels?   Wtf is Mexico's end game here? Piss of the strongest military which happens to sit right next to you, geographically. Piss off the strongest economy in the world, the one which your country piggy backs off?  I know, I know!tell you I am a American without telling you I'm American.
175	176	Humorous	 explances the exodus ,sick or intimidated.
766	767	Humorous	Frantically clapping her hands lead to the investigation.
607	608	Humorous	Now this is Current Events
566	567	Humorous	Delivery of stuff that goes boom more like
283	284	Persuasive	This is context to look back at years from now when it's much worse
800	801	Informational	Hilarious how Hungary now wants to implement an anti corruption campaign. Not  likely to be very efficient or credible when the government is the main cause of corruption
462	463	Persuasive	gotta spend money to make money
134	135	Inquiry	Are they buying 2 jets?
546	547	Humorous	Funny little man said what?
85	86	Support/Disapproval	First time ever I agree with green peace criminal organization.
215	216	Support/Disapproval	High precision Iskanders will target kindergardens or what? Rashist imbeciles, fuck off from Ukraine already.
591	592	Humorous	At least she was conducting herself properly
801	802	Humorous	To be fair, China is a famously hygienic country with no record of causing disease.
758	759	Humorous	I cannot swallow a small pill and this woman was able to do so with 55 batteries, lol.
707	708	Persuasive	Mexican army can learn a lot from Ukraines generals about defending against aggression from within their own borders. Reward valor and remove treasonous agents for one thing.
476	477	Informational	Unfortunately for all involved, four additional batteries remained trapped in the colon. As described in the report, doctors “milked” them into her rectum to remove them from her anus. This brought the total amount of batteries she ingested — both AA and AAA — to a whopping 55.
380	381	Persuasive	Heaven forbid a ceasefire is called, there's only one country that doesn't want a ceasefire, tho in turn means they want to perpetuate war and keep things ongoing.
887	888	Persuasive	Affordable housing, attractive women, delicious cuisine, and good political views.
487	488	Persuasive	There's already a trans-Siberian railroad across Russia.  Building another one there doesn't make sense.  I think this is leaving it to be interpreted as some slight against Russia.  I don't think it is at all  China and Russia and snug as two bugs in a rug.
827	828	Inquiry	intensify ‘special military operation'. - with which troops? More forced prisoners?
534	535	Humorous	She just keeps eating batteries!
567	568	Informational	"This is the best tl;dr I could make, [original](https://www.france24.com/en/europe/20220918-an-increasing-number-of-civilians-are-volunteering-to-defend-armenia) reduced by 56%. (I'm a bot) ***** &gt; &amp;#039;Always on guard in case of new attacks&amp;#039; is the mindset of the increasing number of civilians who are volunteering to defend Armenia agaist Azerbaijan&amp;#039;s forces.  &gt; The volunteer&amp;#039;s training is led by Voma, the largest paramilitary group in the country.  &gt; &amp;quot;We want to test their ability to fight back against the enemy because none of the volunteers have military experience. I am stressed because the majority of the people in this country are not ready and do not want to train and this small group cannot defend our country&amp;quot;.   ***** [**Extended Summary**](http://np.reddit.com/r/autotldr/comments/xhaoxx/an_increasing_number_of_civilians_are/) | [FAQ](http://np.reddit.com/r/autotldr/comments/31b9fm/faq_autotldr_bot/ ""Version 2.02, ~669622 tl;drs so far."") | [Feedback](http://np.reddit.com/message/compose?to=%23autotldr ""PM's and comments are monitored, constructive feedback is welcome."") | *Top* *keywords*: **volunteers**^#1 **train**^#2 **want**^#3 **Armenian**^#4 **country**^#5"
388	389	Support/Disapproval	Seems a little uh, too late?
655	656	Persuasive	That's a long time to make Taiwan the most heavily armed island in the world.
825	826	Informational	They planned to have a bridge connect Taiwan and Mainland China in 2035, this sounds like a proper milestones.
