	doc_id	label	text
712	713	Persuasive	Shame on us, really. The hungarian government undermines democracy and rule of law in Hungary so much for so long that it can no longer be considered a democratic state, violating the rights of the people as well as the treaties in the process, and our best response is to limit the amount of money we're giving them.  So shame on the states preventing action pursuant to article 7 as well.
956	957	Humorous	Welp, game over for the red light district😩
522	523	Humorous	So they bought 3!
803	804	Persuasive	Xi is not learning from the mistakes Russia is making. Instead of trying to invade Taiwan with a shitty military which shares some of the same weakness as the Russian ones, Xi needs to handle his own domestic problems.
947	948	Inquiry	Do chinese normally touch the foreigners?
779	780	Humorous	Hehe you're welcome to try:)
249	250	Persuasive	As long as Russia leaves Ukraine, pays reparations, surrenders war criminals for trial in The Hague and the strengthening of Ukraine's defences continues!
998	999	Persuasive	The nonsense here is mind boggling.  As if Trump had not been directly elected by Russian propaganda campaigns.  All the chanting of build the wall and now you are booty hurt that Mexico is for support of peace negotiations.
378	379	Support/Disapproval	Does NATO approve??? Does nato approve?!?!??! What bs no matter what our glorious sultan does Turkey is stil America's bitch just like rest of the eu zone .yeah we throw tantrum once in a while but this is probably USA way of getting in SCO via Turkey. US has done the  same thing via Turkey to Central Asia and ME before 2016
70	71	Persuasive	U.S. should provide each party's salary based on their voting record for providing the lowest tier instead of kickbacks from the highest tier.    More change than any voter would like though they allegedly might vote for an outsider, especially billionaire outsiders
370	371	Persuasive	That's maybe too simple and a convenient take for NATO countries. Take a Chinese initiative that further diminishes the Need for western logistics and make it sound anti Russian . Clearly Brazil China Russia and India are all trying to break from US and NATO economic influence. The most impactful way is to connect the world via Land routes which would benefit everyone. Except maybe the countries that rely mostly on sea trade routes.   You can pretend this is not about geopolitics, by making claims on efficiency on sea routes but logistical practice will easily crumble that argument. The lack of direct routes for example, the back tracking and transfers etc are too ridiculous to be called efficient.   So this is geopolitical but then you have to admit China has no need to put maneuver Russia when it comes to trade routes. They are more in competition with the ‘Western' world. The same western world which is fighting Russia down to the last Ukrainian so to speak.
393	394	Informational	"This is the best tl;dr I could make, [original](https://www.ukrinform.net/rubric-ato/3573893-wsj-iranian-drones-supplied-to-russia-create-new-dangers-for-armed-forces-of-ukraine.html) reduced by 61%. (I'm a bot) ***** &gt; Iranian Shahed-136 drones supplied to Russia carried out several devastating strikes on Ukrainian troops.  &gt; In his brigade&amp;#039;s operational area alone, the Iranian drones have destroyed two 152-mm self-propelled howitzers, two 122-mm self-propelled howitzers, as well as two BTR armored infantry vehicles, he said.  &gt; The Iranian drones seem to have been mostly deployed in the Kharkiv region, where the 92nd Brigade and other Ukrainian forces carried out a major offensive this month.   ***** [**Extended Summary**](http://np.reddit.com/r/autotldr/comments/xh9owz/iranian_drones_supplied_to_russia_create_new/) | [FAQ](http://np.reddit.com/r/autotldr/comments/31b9fm/faq_autotldr_bot/ ""Version 2.02, ~669609 tl;drs so far."") | [Feedback](http://np.reddit.com/message/compose?to=%23autotldr ""PM's and comments are monitored, constructive feedback is welcome."") | *Top* *keywords*: **drone**^#1 **Iranian**^#2 **Ukrainian**^#3 **howitzer**^#4 **two**^#5"
976	977	Informational	In this thread people are talking about Mexico the same way Trump did.
438	439	Informational	Once when I was a teen I called poison control and asked what would happen if I ate a battery. The lady on the other end asked me if I had eaten a battery. I said no, and that I just wanted to know what would happen. I got bitched out (rightfully so) by the lady for wasting valuable time and resources.   Cool to know now though, that I could eat a battery and be fine!
68	69	Support/Disapproval	Rip those countries
211	212	Persuasive	Soon, Russians will get tired of him
568	569	Informational	"This is the best tl;dr I could make, [original](https://apnews.com/article/russia-ukraine-kharkiv-government-and-politics-c62b2295b4d84da69489ae4e4993bd8d) reduced by 85%. (I'm a bot) ***** &gt; Despite the shelling, a small group of soldiers winds its way along a rutted mud track to where a dead Ukrainian combatant lies, spotted by a drone used to search for bodies and shallow graves.  &gt; The nearby village of Kozacha Lopan, whose edge lies less than two kilometers from the Russian border, was retaken by Ukrainian forces Sept. 11.Vitalii said the team is also hunting for graves of possible vicitms of what authorities say was a makeshift prison where detainees were abused.  &gt; Burial sites have been found in some areas where Russian forces were pushed out, most notably in the city of Izium, where Ukrainian officials say more than 440 graves have been found near the city&amp;#039;s cemetery.   ***** [**Extended Summary**](http://np.reddit.com/r/autotldr/comments/xhap30/near_the_russian_border_bodies_still_lie_on_the/) | [FAQ](http://np.reddit.com/r/autotldr/comments/31b9fm/faq_autotldr_bot/ ""Version 2.02, ~669623 tl;drs so far."") | [Feedback](http://np.reddit.com/message/compose?to=%23autotldr ""PM's and comments are monitored, constructive feedback is welcome."") | *Top* *keywords*: **Russian**^#1 **body**^#2 **where**^#3 **Ukrainian**^#4 **village**^#5"
171	172	Inquiry	So, has anyone figured out what that firefight in Kherson was about or is it still a mystery?
31	32	Support/Disapproval	More BS from Hungary. WTF are they doing in the EU?
946	947	Informational	"An article in the Dutch news referenced this article from the Wall Street Journal. I am unsure how acccurate of a news source this is, but it feels stupid. Because, if this were true, whyblatently tell so??:     [https://www.wsj.com/articles/ukraine-war-depleting-u-s-ammunition-stockpiles-sparking-pentagon-concern-11661792188](https://www.wsj.com/articles/ukraine-war-depleting-u-s-ammunition-stockpiles-sparking-pentagon-concern-11661792188)     ""Ukraine War Is Depleting U.S. Ammunition Stockpiles, Sparking Pentagon Concern"""
481	482	Informational	Wow what a stroke of genius that pro Russia apologists decided to post the same message! 👀   https://twitter.com/voldemortessalj/status/1571314811853570048?s=46&amp;t=HxZK2e_qTWMaEFeUfKHPUw
952	953	Inquiry	Wondering how long delivery times must be by now. Finland decided on 2021 to purchase those with delivery on 2027.
805	806	Persuasive	I can't help but feel a million bots are shutting down anyone who calls for peace.
424	425	Informational	Re-volting.
635	636	Inquiry	Is there anyone else hoping we get a good old fashioned Harry tries to topple Charles and William to take the crown thing?  He would have the backing of the military (I think there is a level of respect for him being one of them??) and the general public like him more than the others (that's the impression I get anyway).
150	151	Informational	No, we do not operate those Chambers anymore
295	296	Persuasive	Will likely end up somewhere else
845	846	Humorous	it only works for the energizer bunny
312	313	Support/Disapproval	Mexico has a lot of nerve coming up with plans to help other countries when it can't even help itself.
706	707	Persuasive	Good luck with that. Apparently they don't understand what's going on in Ukraine.
777	778	Informational	After a month I don't think it's about a cricket match anymore. Seems the nationalism from India and Pakistan is affecting their communities abroad.
77	78	Persuasive	NATO must call Russia's nuclear Bluff or face and even more dangerous Russia later
456	457	Humorous	And they say all the great love stories have been written already.
781	782	Inquiry	So, glancing of this dissertation length article, I still have no clue what to expect for winter in Europe?
880	881	Humorous	Who asked Mexico for their opinion anyway?
695	696	Persuasive	Mexico can't get its own shit together how are they gonna broker any kind of peace
619	620	Humorous	Psssst, Finland, what are your plans next weekend?
561	562	Persuasive	Conspiracy Theory 1- Chinese seismic weapon!
647	648	Support/Disapproval	Maybe the world should stop feeding this monster with money and technology?
928	929	Inquiry	Infected people....bus to concentration camp? Wha......
390	391	Informational	China Signs Major Railroad Deal With Uzbekistan And Kyrgyzstan, Bypassing Russia.  https://oilprice.com/Geopolitics/International/China-Signs-Major-Railroad-Deal-With-Uzbekistan-And-Kyrgyzstan-Bypassing-Russia.html
722	723	Informational	https://twitter.com/bigsac10/status/1571263564056256512?s=46&amp;t=PnI4_lCb_vIscmUEs7pBrQ  Proud to be polish 🫡 our fans always go hard and have 0 fucks to give
793	794	Persuasive	99% sure they wouldn't but that 1% of possibility is what Russia will use as misinformation to make the populace fearful and boost recruiting efforts.
314	315	Persuasive	So this is shaping up to be a decades war, more money for everything the longer it goes on, guess it will keep our economy strong like bear.
298	299	Humorous	"Don't tell the US that you are using the money for ""social assistance and pension payments"" The correct answer is always GUNS! . Christ it's never not guns. I have been thinking about the last balcony scene of Charlie Wilson's war. Will the love stop the minute they defeat the Russians? Or does being on Europe's doorstep buy some love?"
403	404	Persuasive	Americans are failing to understand that the world is making a hard turn against their consensus. The press questions out loud “why isn't the rest of the world joining us in condemning Russia? Why are they not participating in our sanctions?” The people they are referring to are the ‘global south' which Mexico stands with, Brazil, China, India, South Africa, ETC.  Don't take this as an anti American question, but instead try to understand why entire blocs of nations are not standing with Ukraine and just embracing their narrative. You might learn a thing or two about America which you know in the back of your mind but are not fully accepting: American power is on the decline. The new world order is almost over and will be replaced by an eastern world order. Russia India and China.
470	471	Inquiry	Time until parity with the US dollar?
69	70	Persuasive	That's good. It's would have been strange for him to have just dead stopped something he's been so passionate about for so long.
292	293	Support/Disapproval	I want gas, Putler. But what I want even more is your troops off Ukrainian soil.
869	870	Humorous	Great now somebody will do 56
362	363	Inquiry	I'm guessing dementia?
205	206	Humorous	&gt;*In Costanza* ”Russia is getting upset!”
798	799	Informational	I feel like a stranger in my own Country. Is this the UK I was born into ?  I no longer recognise it.
60	61	Humorous	Watch out guys, if Putin gets any angrier he might assassinate another one of his oligarch cronies. Wouldn't that be horrible?!
692	693	Support/Disapproval	Good. Fuck Putin and shame on all Russians that are pro Putin.
790	791	Persuasive	Oh no. We don't need Taiwan to have a power grid blackout.
15	16	Informational	Misleading headline; this decision wasn't about Russia or sanctions.  The article states that China had been negotiating for *years* (read: before 2022) to extend its existing railroad through Kyrgyzstan.  It also points out that this route to Europe is 900km shorter than a hypothetical route through Russia. This is simply a sound logistical decision. It's implied that there was never an option on the table about going through Russia.
804	805	Humorous	All charged up with no place to go.
176	177	Informational	&gt;Meet the Ukrainian Neptune anti-ship missile, moskva-killer class.   Source: https://twitter.com/DefenceU/status/1571162350333427712?s=20&amp;t=AmpMdcyytsAc15nUulcEtQ
583	584	Informational	"General reminder that a lot of far-right, far-left, and ""grass roots"" political movements receive funding by Russia, and, despite all their own domestic problems, Iran and Venezuela.  Not because of any ideological sympathies, but because ""enemy of my enemy"" convenience."
115	116	Persuasive	I wouldn't call this a “rumour”. This was a small group of conspiracy nuts convinced (among other things) that the government drank children's blood etc for rituals.
427	428	Informational	"Mexico has always had a ""neutral"" position in the face of international conflicts. it is convenient for the United States, since otherwise, Mexico would be a weak flank for the protection of its territory."
120	121	Persuasive	Thank us with oil ya dinks.  You think it humanitarianism shipping that cheddar?!?!   Don't make us liberate you fucks so get in line.
901	902	Informational	It is ironic since Armenia is one of the few states supporting Russia invading Ukraine...
411	412	Informational	This is a major event, probably more than most realize. Nearly all the cargo arriving in Europe (and most of it in America) from east Asia goes through that canal. It'll influence billions of lives.
886	887	Persuasive	A shockingly large number...
621	622	Humorous	I want to see a footage of Turkish and Iranian drones dogfighting and then another about Bayraktars destroying them.
797	798	Inquiry	Peace talks with Russia? How many times did they break ceasefire agreements?
908	909	Humorous	Some people make piles of shit, some make shit of piles.
490	491	Informational	https://yle.fi/news/3-12626182 - Exclusive: Russia moves missiles from St Petersburg to Ukraine  Satellite images obtained by Yle show that Russia has been transferring anti-aircraft missiles away from St Petersburg, close to the Finnish border.  Finnish state media.
162	163	Inquiry	How can Harry act on his behalf?
301	302	Informational	Ah yes. Europe and its principles. We'll see how long this will last. Went from refugees welcome to having Sweden elect a far right government in just 7 years because of a few incidents and a small economic crisis.
12	13	Support/Disapproval	I hope that bald, shaking, swollen gonad dies soon
404	405	Support/Disapproval	If the conflict is still going then, fuck it all I'm done
59	60	Inquiry	After reading the comments here it seems like a lot of mexicans are expressing the notion that Mexico has a generally pro-russia outlook.  Could a mexican here kindly explain to me the roots of Russia's pro-Russia stance?  I had no idea.
160	161	Inquiry	Can it be a coincidence? Why now?
331	332	Inquiry	Why should I care about figurative King doing figurative things? Or cutting out his family out of doing those?
79	80	Humorous	So many experts here who can't fly a paper airplane
977	978	Persuasive	I don't think any warnings from Joe Biden scare Putin.
856	857	Humorous	Nukenami
764	765	Persuasive	I would recommend going there having a beer in the Brouwerij De Molen, a local brewery located in an old windmill.
497	498	Persuasive	Twitter doesn't have good moderation, intentionally.
376	377	Humorous	No one: Literally no one: Mexico: hold my taco
675	676	Humorous	This is like Russia is trying to pay a cat, and it does the Mexican wave to avoid your hand.
724	725	Informational	Eliminated enemy tank. Eastern direction.  https://twitter.com/TpyxaNews/status/1571409950693556224?t=m3orhwkaeENddlaSCg8D5g&amp;s=19
396	397	Humorous	I can't wait to find out what China's going to fuck them out of next year when they can't pay back their loan with exorbitant interest
382	383	Informational	You can see her shit in the photo of the batteries by the way.
143	144	Informational	Mexico can't even manage it's own country. To us foreigners it seems like a corrupt, impoverished, bloodbath. This plan is counter productive, and just further portrays another prolonged border conflict since 2014. There was up to 400,000 Nato U.S personal waiting at borders during this conflict. Keep it up and see what happens hey!
61	62	Persuasive	The thing the worlds needs most right now, is for Donald J. Trump to be charged and imprisoned for high treason, corruption and god knows what other crimes he has committed.  His piss-poor leadership, and crusade on dismantling western unity and American standing in the world is what allowed this conflict to happen in the first place (both indirectly, and directly by blackmailing Ukraine). Along with making authoritarian countries confident enough to openly challenge the west with their new alliances (which are luckily, so far a complete joke, but if the west keeps derailing they might become a threat).  This is just what happens when the only superpower allows an orange moron to take the wheels.
871	872	Informational	It looks like OP posted an AMP link. These should load faster, but AMP is controversial because of [concerns over privacy and the Open Web](https://www.reddit.com/r/AmputatorBot/comments/ehrq3z/why_did_i_build_amputatorbot).  Maybe check out **the canonical page** instead: **[https://www.dw.com/en/swedish-election-the-astonishing-rise-of-the-right-wing-sweden-democrats/a-63100694](https://www.dw.com/en/swedish-election-the-astonishing-rise-of-the-right-wing-sweden-democrats/a-63100694)**  *****   ^(I'm a bot | )[^(Why &amp; About)](https://www.reddit.com/r/AmputatorBot/comments/ehrq3z/why_did_i_build_amputatorbot)^( | )[^(Summon: u/AmputatorBot)](https://www.reddit.com/r/AmputatorBot/comments/cchly3/you_can_now_summon_amputatorbot/)
819	820	Persuasive	Oh lord, and right now they are begging for international aid to help the victims of the recent floods....  The level of corruption and stupidity in that country knows no  bounds.
987	988	Informational	You guys, she ingested them. Swallowed these batteries whole, and she was 66 years old.
691	692	Informational	The Guardian isn't exactly a [reliable](https://mediabiasfactcheck.com/the-guardian/) news source
634	635	Support/Disapproval	Hmmm go get more yuan
372	373	Persuasive	I think pride parades are dumb as shit but nobody should have the right to attack anyone based on their sexual preference. If you are a man who wants to fuck another man or a woman who wants to fuck another woman, that's ok do what makes you happy but it's kind of dumb to advertise hey I am gay or lesbian and I like to fuck my own genders. Straight people don't do that shit. Sexual preference should be a private matter however no justification for right wing mobs to attack them.
975	976	Persuasive	Not so fun when it's you now is it
29	30	Humorous	He ain't special, I've got flushable toilet paper rolls too.
471	472	Inquiry	I wonder if we will soon see referendums in eastern Manchuria on joining China 🤔
316	317	Support/Disapproval	This just means that we're all going to be paying for this. Inflation is a bitch
950	951	Humorous	I don't think there's many orgies with Monkey Pox infected people in China at the moment.
148	149	Informational	Azerbaijan regained it's rightful territories, as recognized by the UN- armenia illegally occupied them.
405	406	Humorous	What a shocker!
666	667	Persuasive	There is something to be said about Chinese foreign policy. They don't, usually, act irrationally. If you follow their logic, they generally take the most rational path. Predictable in a ruthless sort of way.   Obviously, they aren't using the exact same logic as western liberal democracies. The whole border shit with India strikes me as needlessly provocative to a country that isn't, necessarily, in the western camp.  I hope they soon come to see that aligning themselves with an irrational country like Russia is a poor move.
826	827	Humorous	How will a VPN help Europe?  Oh, I get it. They can secretly buy the gas without Russia knowing where the buyer is. Brilliant!
505	506	Humorous	Which Tik Tok challenge was that...?
104	105	Informational	"That is the second-best fighter aircraft in history. The first is the F-22 Raptor. The RCS of the 35 is the size of a cicada. The RCS of the Raptor is the size of a GNAT. Further, ""5th Gen"" aircraft by Russia and China are far closer to 4th. China copied a Russian plane. Too bad that plane is plagued with problems!"
41	42	Support/Disapproval	Meanwhile Congress assures the people there just plain isn't any money for education or infrastructure.
682	683	Humorous	Someone leaked the script for Alan Wake 2.
919	920	Persuasive	All investments in the Russian dictatorship was lost.  China is next: you don't invest in China, you give away money, you'll never get anything back.  Stop investing i dictators. Stop fuelling wars on democracies.  Maybe we should simply ban investment and trade with countries like China.
870	871	Persuasive	That is just solid advice in any country really.
914	915	Persuasive	I'll be honest I've no idea how big the ammonia market is. If this can save lives and bring men and women home then it is a good thing.   I know of ammonia from using it in the gym in the form of smelling salts.   Hopefully Russia will at least discuss the matter and possible agree to this as well.
752	753	Informational	"This is the best tl;dr I could make, [original](https://news.sky.com/story/police-call-for-calm-after-outbreak-of-disorder-in-leicester-12700352) reduced by 74%. (I'm a bot) ***** &gt; Police and community leaders in Leicester are calling for calm as they deal with &amp;quot;Disorder&amp;quot; on the streets, which has bubbled over again following an India v Pakistan cricket match last month.  &gt; &amp;quot;Speaking on a Twitter video on Saturday, Leicestershire Police temporary chief constable Rob Nixon said:&amp;quot;We have had numerous reports of an outbreak of disorder in parts of the East Leicester area of the city.  &gt; Leicester MP Claudia Webbe also called for calm and urged people on the streets to go home.   ***** [**Extended Summary**](http://np.reddit.com/r/autotldr/comments/xhbp78/police_call_for_calm_after_outbreak_of_disorder/) | [FAQ](http://np.reddit.com/r/autotldr/comments/31b9fm/faq_autotldr_bot/ ""Version 2.02, ~669627 tl;drs so far."") | [Feedback](http://np.reddit.com/message/compose?to=%23autotldr ""PM's and comments are monitored, constructive feedback is welcome."") | *Top* *keywords*: **Leicester**^#1 **Police**^#2 **area**^#3 **call**^#4 **calm**^#5"
233	234	Humorous	The enemy of my enemy is my customer.
333	334	Support/Disapproval	What a crock of bullshite.
863	864	Support/Disapproval	Fuck el cacas
746	747	Persuasive	They didn't include Turkey in EU, so it's appropriate.
573	574	Humorous	:Unfortunately for all involved, four additional batteries remained trapped in the colon. As described in the report, doctors “milked” them into her rectum to remove them from her anus. '  r/brandNewSentence
422	423	Informational	The Egyptians didn't even build this.
754	755	Inquiry	Well what's the 2nd highest number?
469	470	Support/Disapproval	Russia instills terror in the individual, not as a whole. It's known their goal cannot succeed. They lack manpower and equipment to even hold a fraction of Ukraine without their country remaining open.  These types of savage fear tactics only work when winning and it becomes an inevitability anybody who resists will face such punishment.
747	748	Humorous	So I have to eat 56 for the world record?
492	493	Support/Disapproval	Merica
554	555	Humorous	She fell down on those batteries, a tale as old as time. Who hasn't accidentally fell down on some thing and those things ended up their arse?
611	612	Humorous	They're a good famine away from that.
958	959	Inquiry	Aren't the F35 disasters?
182	183	Informational	Map is in the article. By “near” it is still closer to China than Taiwan
603	604	Humorous	I'm more of an express vpn guy
656	657	Humorous	Klichkó does not approve this message 🥊
844	845	Humorous	Didn't someone tell her the batteries go in to the vibrator and not her body?
646	647	Humorous	Trying to think of some witty Duracell pun.
310	311	Persuasive	Ukraine just should keep to their plan. Which is Russia gets out of all Ukraine land and territory. Period.  There are no peace talks needed. Gtfo, or we will forcibly remove you. Once your gone, wars over. You lost.  Come back and start more shit? Not only will we not let you in, at that point in time we will sit at our borders and artillery and himars the shit outta every military target we can hit.  You started this war. And are losing. Once you have been pushed out of Ukraine you can decide what's best for you.   What's best for Ukraine we decide.
337	338	Humorous	Oh boy he's folding to the will of the mob already 🙉
435	436	Persuasive	Knowing China they gonna use these trains to explore Uighur Muslims back to their motherlands. Knowing China there will be some debt trap involved too.
794	795	Persuasive	This post should have used the article's title, far more entising than what OP chose.
846	847	Informational	You mean just Palestine. None of this area is Israel
702	703	Humorous	What do you think they are!Russian?
558	559	Humorous	Was she!. turned on?
369	370	Support/Disapproval	Ohm my god wtf
597	598	Inquiry	Is this site full of bots fun by the CIA?
864	865	Humorous	Don't touch them in their butts with your pee pee
75	76	Humorous	Sounds like Swedish streaming service.
