	doc_id	label	text
322	323	Informational	Russia has had a presence in Mexico since at least the 1930s my mother remembered Russians coming to her home city of San Luis Potosi spreading communism.
638	639	Support/Disapproval	Russian murderers have no business making advanced weapons anyway
913	914	Humorous	Someone should explain to her how a vibrator actually works
589	590	Humorous	The most literal meaning of an alkaline diet
512	513	Inquiry	Why though? Traditionally neutral, so what are they going to do with high end fighter planes?
990	991	Persuasive	"This man has constantly a lot of ""good"" ideas.. mostly coming from the voices in his head and not based on actual reality."
136	137	Support/Disapproval	🥶
317	318	Inquiry	Is he also calling in a skilled executioner to have them beheaded?
100	101	Persuasive	Not gonna end well.
494	495	Support/Disapproval	Mexican government, go fuck yourselves.
582	583	Inquiry	Was it one of those Japanese ones with realistic movement and such?  Japan has all that kind of stuff...
251	252	Support/Disapproval	Imagine if poms could vote for their king!   They could have had David Attenborough as their King right now, inspiring a whole country towards science and natural exploration and people all over the world would be looking in awe of this progressive system!  Instead they have fucking  Charles.
644	645	Informational	I think before then
935	936	Persuasive	“What can we say? An order is an order. We didn't have a choice,” says one wearing a hat emblazoned with a Z  A walking contradiction. If you don't agree with the mission just go to jail or better yet leave the country.
991	992	Informational	BREAKING: 🇪🇺 suspending 65% of 🇭🇺 Hungary's EU funding because of Orban's attacks on the rule of law, announces Commissioner J Hahn EU.  It pertains to €7.5 billion in funding.  https://twitter.com/DaveKeating/status/1571423790373937153?t=XmJO5VUB8gMIZjQe3oSiEA&amp;s=19
444	445	Support/Disapproval	Right or wrong this makes me feel good that some Russians are feeling what the Ukrainians have been feeling for the l7 months ( 8 years in some areas) even their own soldiers are treating them like shit. Karma bitches, fucking karma always comes knocking.
479	480	Inquiry	Did she eat them or..ingest them in a different way?
972	973	Persuasive	That's not how energy drinks work, darling.
823	824	Inquiry	"what's with the addition ""highest reported number ever"". Is this something that is done a lot?"
689	690	Humorous	He should stop prince Andrew from being a creepy kent! Lol
815	816	Humorous	She needs a bonk
151	152	Humorous	Don't worry guys, they are spending half a billion dollars on upgrading their F-16s.  They will be able to dry all that stagnant water with precision guided munitions.
574	575	Humorous	Was she booked for assaultin' battery?
651	652	Humorous	Your character gets hit with a wall of text for 3000 HP. You die.
817	818	Inquiry	Can you just turn on the pipe and like not pay them a cent till they cut it off? Like letting the gas flow and then just dont pay the bill?
207	208	Persuasive	He definitely makes the war looked like its all the west
683	684	Informational	Im mexican and I didn't know we were allying with russia, or spreading their propaganda, I think we should be working on ending our internal war ( drug war ), but the president is a narco himself, anf doesn't do shit about criminals.
449	450	Inquiry	Omg I just looked up the current Mexican president!  WTF is going on in Mexico?? Since when is Mexico so misinformed and radical? How did I never hear about this Mexican Trump?
447	448	Informational	"I often like to report to people what Igor Girkin (Russian war criminal that helped to create the terrorist ""State"" of the DPR in Ukraine) is talking about on his Telegram so others don't have to go on it.  Well recently I haven't been able to do that, as most of the posts he's made have been long, rambling rants making fun of Russian leadership and it seems at this point he has had some sort of small mental break. It seems that he has admitted to himself at least somewhat that his work has failed, he repeatedly has lambasted Russian leadership and believes wholeheartedly that the war is lost unless Russia fully mobilizes their reserves and economy, even he admits this is unlikely due to lack of general support.   Only useful information is this, Ukraine maintains it's bridgehead across the Inhulets river, west of Kherson, despite Russian efforts to dislodge them. He even reports that Ukraine has managed to take back the village of Mala Seidemynukha in this area and push the front back in other areas.   It's hard to find info on this village, but it's less than 100 acres and the population is likely fewer than 200. **This information does not compromise Ukrainian OPSEC as the information is publicly sourced from strictly Russian sources.**"
357	358	Inquiry	Why is AMLO and his government supporting Putin? Serious question.
247	248	Informational	Russian spies arrive into the US via Mexico.
224	225	Persuasive	https://en.wikipedia.org/wiki/Khojaly_massacre  You know why Azerbaijan is this hateful? That happened in 1992. They built up an arsenal of weapons for this war since that day when Armenia took Susha.   It's an ethnic war.   The people who are pro Armenia is conveniently overlooking that they took lands from Azerbaijan.   Azerbaijan war atrocities is bad  but they're painting it as if Armenia is the good guy. It ain't black and white.  I'm more surprise why Armenia didn't keep up with their defensive since 1992. While Azerbaijan bought tons of weapons.   Also it's a shit spin on dictator.  It's like justifying Iraq invasion cause he's a dictator after not finding weapon of mass destruction. Also don't circle back about Azerbaijan starting this, they want their land back.   It's a fucking ethnic war. Europe should send their peace keeper.   The most USA should do is broker some peace deal. We shouldn't be picking side on a fucking ethnic war. We should stop them if there is a genocide but not when they're fighting for a piece of land.
622	623	Persuasive	It's irrelevant. Such a stupid plan would be vetoed by the US and UK and so it's basically dead already.
267	268	Support/Disapproval	This is as the Egyptian government spends billions on skyscrapers and military bases
465	466	Humorous	Everything...but pulling out. That would be epic cringe. /s
16	17	Support/Disapproval	Woohoo new thread! Slava Ukraini, fuck Putin!
773	774	Humorous	Belarus lite
291	292	Persuasive	The reality of Kherson street fighting likely lies in the middle of all the claims. Both sides seem to have disliked like the outcome since everyone clammed up. I think Russia had the upper hand in some partisan or UA spec ops engagement. Ukraine probably was running an operation and Russia stopped it but UA slipped away.  If Russia stopped a serious operation, we'd see bodies. If it was infighting, UA's intelligence network would have let us know with recordings and data.  If this was staged, Russia has outclassed every previous piece of staged prop. Their bad stagings are even a running joke here.  Russia probably thought they had the upper hand which is why they leaked it. They were unable to finish the job though which is why they clammed up. Ukraine has no reason to comment.
550	551	Inquiry	Anyone has news regarding War in Ukraine channel on Youtube: he has missed yesterday's as well as today's update.
697	698	Informational	&gt; Chinese companies have sold 4 million tons of LNG on international    markets. That represents about 7% of Europe's gas consumption for the    first half of the year.  Not much  &gt;  the EU has not sanctioned Russian gas  &gt; Russia's sales of pipeline gas to China grew by almost 65% in the first six months of the year  &gt; What Russia sells to China is also on a contracted price basis and, from my understanding, the deal that China and Russia made for Power of Siberia 1 was rather more advantageous toward China, also in terms of price
723	724	Humorous	Chinese are different.
11	12	Support/Disapproval	Yet the US can't give a cent more to address homelessness amongst American citizens.
503	504	Humorous	I thought Germany had a faster track record of moving through Eastern Europe than this.
255	256	Inquiry	All I wanna know is, is this gonna effect striper fishing for the fall?!?!
555	556	Support/Disapproval	The USA can always find a few billion for war. But has temporary blindness finding funds for education, homelessness and welfare.
64	65	Persuasive	When Russia restores all of Ukraine, including Crimea, then maybe such a thing can take place.  Ukraine then has time to ascend into NATO status, and after, nothing can touch them.
576	577	Persuasive	"The world politics &amp; power slowly shifting. US &amp; Europe losing their place as leaders of the world, due to the occupied lands throughout history now wanting independence. Not saying this is right or wrong way forward, just as it seems to me. The world is much bigger than just the 5 nations trying to control. As to Cyprus, Turks were there for centuries so Greeks to ""take back"" what exactly? If its working as separate nations peacefully leave well alone. More deaths &amp; wars not needed in the world."
680	681	Support/Disapproval	No.
530	531	Informational	&gt; “I see them buying these things, and I wonder why they don't already have [them],” she also says, adding that the troops are buying basic food and cooking implements that she expected would be supplied by the army.  When propaganda hits reality.
523	524	Inquiry	Carry on? Did I miss something
753	754	Inquiry	Why would people rush to live near areas with land mines?!
600	601	Support/Disapproval	Defending your family, home and country from aggressor invaders is a human right. What Russia is doing is illegal, a crime against humanity and just plain wrong. You are behaving no different to when you allied with Nazi Germany and invaded Europe last time with them. Go home Russia. No one likes you anymore.
738	739	Persuasive	There is a sense, even among Putin supporters, that Russia is losing hearts and minds in Ukraine.   figuratively &amp; literally
514	515	Persuasive	Suddenly the absurd amount of Russian foreign agents in Mexico all makes sense
204	205	Support/Disapproval	Sometimes I'm ashamed what Mexico does like wtf amlo
807	808	Inquiry	So Armenia will get weapons now?
3	4	Informational	You can't fix oil dependency on the supply side.
933	934	Inquiry	So I assume that huge chunks of the Ukraine economy are non-viable at this point right?  Like no one is paying their mortgage, car loans, or credit cards right? No one is continuing to pay a mortgage on a destroyed house right? Or at least in portions of the country this is true right?
58	59	Support/Disapproval	The only deal acceptable is for Russia to leave Ukraine and respect the at pre 2014 borders. Pay Ukraine for destruction and rebuilding. Russia just go home as no one likes you anymore.
303	304	Support/Disapproval	Mexico is an absolute fucking narco state.  I would take any attempt to influence by them with a grain of salt.  Or more like a pinch of coke.
544	545	Informational	It's not conflict, Tajikistan again attack Kyrgyzstan, before they did on spring 2021 and now attack Batken and Osh. [information in english here](https://www.instagram.com/p/CikVUsFoq29/?igshid=NmNmNjAwNzg=)
87	88	Support/Disapproval	Fuck no POO-TIN(pot-dictator)
744	745	Informational	One of my dream destinations, actually. I don't want to go to Goa that much, though, but more for Tadj-Mahal and other cultural historical places. Heard that it's a dangerous place for females, so will have to wait for a company to go there..
138	139	Persuasive	He should play Russian Roulette instead of considering nuclear weapons.
339	340	Support/Disapproval	I'm a rather big electricity user with 10k kwh per year. My electricity bill went from 250 euro to 1250 euro (my mortgage is 800), but Putin can suck my dick.
532	533	Support/Disapproval	It's not where your life began. It's what you do with that life and where you die that matters.  Much respect for her. RIP
274	275	Persuasive	Cheap Russian gas is attractive, but now there is too much blood, deportations, war, and genocide that makes that resource from Russia accept all those violations. This means it's impossible to make any deals with Russia until they have left Ukraine and Crimea and have come up with a solution to cover damages to Ukraine, Europe and other countries that suffered. That won't be easy.
289	290	Informational	Finnish public broadcaster [Yle reports that Russia has moved AA missiles from St. Petersburg for use in Ukraine](https://yle.fi/uutiset/3-12588962). (Article in Finnish, but it has self-explanatory scrubbable before/after satellite pictures) There are 14 anti-air defence bases around St. Petersburg, four of which have been emptied of missiles. The moved systems are S-300s, most likely used as cruise missiles to bomb Ukraine.
180	181	Persuasive	If even China is afraid to do business with Russia things are grim. I hope Russia is ready to be set behind for the next few decades. It will take so long to rebuild that relations/trust and that won't happen til a major shift occurs in the country
849	850	Persuasive	It doesn't make sense.  The record should be for the highest capacity, not the number of batteries.
737	738	Informational	"Russia is a ""Mafia run gas station masquerading as a country"" according to John McCain."
123	124	Persuasive	Price per unit and maintenance costs on F-35's just keep going down. I think in the end it's going to be every bit as successful and widespread as the F-16. Thanks Putin. Ya evil dumbfuck.
156	157	Humorous	So one fighter + Maintenance package.. fuel and training not included
84	85	Persuasive	I really hope we are training Ukrainian's on newer Patriot systems right now. Ukraine's intercept rate with current defenses seems to be about 50% right now. With Russia threatening to go scorched earth and take out civilian infrastructure we need to make sure Ukraine is better capable of being able to defend itself from Cruise missiles.
520	521	Humorous	Challenge Accepted
679	680	Humorous	The doctor asked me how many batteries I had eaten and I replied “just the usual amount”.      “The usual amount is zero,” he said.
248	249	Support/Disapproval	Our Mexican Prez is a dumb ass
511	512	Support/Disapproval	mexico?
268	269	Informational	"I'm not posting this for karma, I'm posting it for posterity.  I may never remember it if I don't. Recently, WWII vet Woody Williams passed away (Google him, he's an entire rabbit hole of a story himself), and there was a huge celebration of his life in Charleston, WV, near where he lived. Two days in a row, my daughter and I happened to be parking in Charleston, at completely random times, and got to witness F-35's ripping at full-tilt out of [""Chuck""] Yeager Airport (also named for a legend worthy of a rabbit hole search). She was obsessed with Top Gun at that point, so it was just that much cooler of an experience. I hate war, excess, and the fact that these jets need to even exist in a defensive and not progressive sense, but seeing them in person never gets old."
223	224	Humorous	Through the Ukraine invasion Putin successfully made Russia China's bitch.
39	40	Support/Disapproval	Skylarking
711	712	Humorous	So China admitted that Taiwan is a Nation and want to invade Taiwan, based China
259	260	Humorous	Silly Putin, Nordstorm store hours are online. He doesn't need to demand anything
997	998	Persuasive	Everybody around Ukraine is calling for Ukraine to get weapons.   That's loud.
426	427	Humorous	We don't care what he does on the can!
42	43	Humorous	Turn it back on and toss a lighter into the pipe.
320	321	Informational	&gt;What a stroke of genius that all those people decided to post almost the same message!  https://twitter.com/voldemortessalj/status/1571314811853570048  On Russian disinformation accounts on Twitter.
808	809	Persuasive	More like 2023. 2027 smells like bullshit to me. Xi has been waiting to pounce on taiwan but has withheld doing so based on current economic conditions and how Russia is getting their ass handed to them in Ukraine
125	126	Support/Disapproval	Corrupt Ramaphosa is the real punishment to his country.
879	880	Persuasive	It's nice that there would be some political variation in Sweden.
478	479	Humorous	I prefer rafele
137	138	Support/Disapproval	Actions have consequences.
596	597	Inquiry	Huh? (Without reading anything else and looking for a short answer)
698	699	Humorous	“Mexico”
674	675	Humorous	She needs more batteries to run than my kid's remote control car..
96	97	Humorous	Day CCVII, Part I. Thread CCCXLVII.
688	689	Humorous	Also Putin: If you're homeless, just buy a house. Duh.
489	490	Persuasive	This is the tip of the iceberg
556	557	Inquiry	I don't even know what's going on anymore?!?
67	68	Humorous	With cost overruns that will be what, two jets total?
308	309	Support/Disapproval	This guy can't even keep his house in order!why would anyone care about what he champions
440	441	Support/Disapproval	Soon no one will want your gas chutin.
99	100	Inquiry	Are we at the “and even Walter Cronkite now says that the war is now unwinnable” part of this for the Russians yet?
385	386	Humorous	Better hide the journalists, then.
811	812	Humorous	and just like that David Blaine just announces his new show
654	655	Inquiry	India, what game are you playing?
769	770	Persuasive	Not one mention of race. You know if it was anyone else it'd be in the title.
439	440	Humorous	He will do it from a private jet travelling the world.
477	478	Humorous	DURALAX! Not Duracell.
430	431	Informational	Unlikely, as long as crude oil is traded in US$
324	325	Persuasive	he was just a criminal (not black). criminal havent race, nationality, religion
838	839	Informational	&gt;“He has not made the decision to do that, but he has asked his military to put him in a position where if that's what he wanted to do, he would be able to. It's still the assessment of the IC as a whole that Xi's interest in Taiwan is to get control through nonmilitary means.”  Source: [https://twitter.com/KatieBoLillis/status/1570808624049537026](https://twitter.com/KatieBoLillis/status/1570808624049537026)  Seems more like a attempt to have some sort of achievement at the 100th anniversary of the PLA which is at 2027.
377	378	Persuasive	It's a win win. The combat data on the effectiveness of the weapons is a sweet deal alongside kicking the ass of the invaders.
776	777	Inquiry	Who the fuck are they gonna bomb with those F-35s? Italian hikers lost on their side of the alps?
455	456	Persuasive	If the enemy chooses right conditions to attack where the f35 can fly, it may be a game changer.  Maybe a game changer cause if the enemy chose to fight in conditions where the f35 can fly, it will be an enemy that has lost the battle already
563	564	Informational	"This is the best tl;dr I could make, [original](https://amp.theguardian.com/world/2022/sep/18/ukraine-war-cross-border-russia-putin-belgorod) reduced by 95%. (I'm a bot) ***** &gt; Sun 18 Sep 2022 06.00 BST. The war has become impossible to ignore in Belgorod, southern Russia, just miles from the border with Ukraine.  &gt; As the Russian front in Kharkiv has collapsed and Ukrainians who have chosen the Russian side have fled for the border, a dark thought has crossed the minds of ordinary people here: that the war may cross into Russia.  &gt; Ukraine has not given any indication that it intends to cross the border or do more than retake territory occupied by Russia.   ***** [**Extended Summary**](http://np.reddit.com/r/autotldr/comments/xhaor3/russians_now_feeling_the_pain_of_ukrainians/) | [FAQ](http://np.reddit.com/r/autotldr/comments/31b9fm/faq_autotldr_bot/ ""Version 2.02, ~669620 tl;drs so far."") | [Feedback](http://np.reddit.com/message/compose?to=%23autotldr ""PM's and comments are monitored, constructive feedback is welcome."") | *Top* *keywords*: **Russia**^#1 **war**^#2 **border**^#3 **people**^#4 **Russian**^#5"
728	729	Humorous	Only 55??? Challenge Accepted
895	896	Persuasive	Pretty sure it isn't Covid, they being drained of talents and high income earners after how the last mass protest went down
983	984	Persuasive	Consider this. Invade Russia, then trade it for the territories they invaded on Ukraine.
17	18	Inquiry	If Russia Accepted the peace talks the first time or the second time or the third wouldn't they regroup regardless?
672	673	Persuasive	The article stated it was self harm. I'm always shocked to hear about this from a person 60+ years old. Once you make it past 40 the odds of you trying to complete suicide greatly diminish. At best this was an act of self harm like cutting, at worst this was an attempt to complete suicide.
785	786	Informational	Sounds like it's more fir corruption than fir damaging democracy.  The fact that corruption damages democracy is not lost on me btw.
569	570	Informational	I am German and I did not hear about this
639	640	Inquiry	“Highest ever” there are more cases?!?!?
187	188	Support/Disapproval	Mexico is a failed state. A narco state. A sad state 🙁
121	122	Support/Disapproval	Chinga tu propuesta México
297	298	Persuasive	AMLO loves the poorly uneducated. His Russian-backed political party is compromised and bankrolled by shady background figures. And his followers are deranged cult sheep without so much as a middle school education. Mexico deserves better in 2024.
196	197	Humorous	Peace plan option - Lay down weapons &amp; equipment, head towards Russian border, and no one will shoot you.
400	401	Humorous	Terror tactics ain't so fun when the enemy throws them right back at ya, eh putin?
281	282	Support/Disapproval	Mexico is surely a very wrong country to tell us how to deal with the russia problem.
941	942	Humorous	This news is shocking
900	901	Informational	**Full Transcript Below:**  *18.09.2022 06:53*  *Minister of Foreign Affairs of Lithuania Gabrielius Landsbergis called for the transfer of more weapons to Ukraine, commenting on the mass crimes of the occupiers in Izium.*    *“Words failed to prevent mass graves. Condemnation alone won't bring this genocide to an end. Tanks speak louder than words. #ArmUkraineNow means now,” Landsbergis posted on Twitter.*        *As reported, President of Ukraine Volodymyr Zelensky said that more than 400 bodies, including those with signs of torture, had been found in a mass grave in liberated Izium. Children and military personnel of the Armed Forces of Ukraine are among those identified.*         *As of September 16, law enforcement officers discovered 10 torture chambers in the territories liberated from the Russians in Kharkiv region. Six of them were found in Izium.*
311	312	Humorous	I have a friend who was traveling in the opposite direction. He didn't get a good look. But he did say it Torah hole through the highway.
955	956	Humorous	Having grown tired of cheese and chocolate, the Swiss have evidently decided to return to their roots. Mercenary time
475	476	Humorous	Con...grats?
493	494	Support/Disapproval	Thank you for sharing.
585	586	Persuasive	When the USA just promove the war. China is the future for a world more integrated and peaceful. The commerce is a number one enemy of the war.
226	227	Informational	It looks like OP posted an AMP link. These should load faster, but AMP is controversial because of [concerns over privacy and the Open Web](https://www.reddit.com/r/AmputatorBot/comments/ehrq3z/why_did_i_build_amputatorbot).  Maybe check out **the canonical page** instead: **[https://www.business-standard.com/article/international/global-order-must-be-anchored-in-int-l-law-india-on-armenia-azerbaijan-122091600070_1.html](https://www.business-standard.com/article/international/global-order-must-be-anchored-in-int-l-law-india-on-armenia-azerbaijan-122091600070_1.html)**  *****   ^(I'm a bot | )[^(Why &amp; About)](https://www.reddit.com/r/AmputatorBot/comments/ehrq3z/why_did_i_build_amputatorbot)^( | )[^(Summon: u/AmputatorBot)](https://www.reddit.com/r/AmputatorBot/comments/cchly3/you_can_now_summon_amputatorbot/)
409	410	Humorous	So what you're saying is if I put 56 batteries in my body I'm the new record holder
256	257	Support/Disapproval	Can he shut up? Asking for a friend.
124	125	Persuasive	UNPOPULAR REDDIT OPINION:  China is the only hope this planet has.  A lot (probably most) of the West is sliding into open fascism, including America. China, even if only nominally left, is all we have left to fight the scourge.  God help us all.
332	333	Informational	"&gt;Meanwhile on RT's show ""Beautiful Russia,"" propagandist argues that Russia shouldn't worry about the way events like Bucha are being perceived or covered in the West. Instead, he says, Russia should lay into that: ""Yes, that's how we are... We'll show you even more. Fear us!""  https://twitter.com/juliadavisnews/status/1571266222871789575  &gt;More genocidal propaganda on Kremlin-controlled state TV. Pundit argues that for Russia to win this war, all of Ukraine's critical infrastructure has to be destroyed. He says it doesn't matter how awful it looks, since the West already considers Russians a horde of barbarians.  https://twitter.com/juliadavisnews/status/1571233267751215104"
586	587	Inquiry	What was the reason?!?!
954	955	Persuasive	Russia has practically become a vassal state of China.
472	473	Humorous	A simple russian guy had a lot of work in Bucha and Izum, now he wants to relax and have some fun in Australia on vacation.
208	209	Humorous	Still going huh?
194	195	Humorous	I'm no expert, but I'm fairly certain this means the Kaijus are about to emerge.
