	doc_id	label	text
549	550	Humorous	Is her last name Tesla?
112	113	Persuasive	Sounds like the morals police have no morals. Only people who chose at conception to be male should have those rights.
713	714	Informational	They are fearful but ultimately, for the Ukrainians, it wouldn't be worth it. If they get back all territory taken by the Russians, you could easily see the Ukrainians digging in. They now have the capabilities to stop an invasion force massing on their border.
94	95	Humorous	To pull an oldie out!  It's day 207 and Russia still doesn't have air superiority
334	335	Humorous	Thanks oilprice.com for the News Update..
717	718	Persuasive	The arbitrary squiggle when British American cartographers drew there own map at the end of world war 2 is the basis of what you consider to be a nation.  The truth is the other nations are identical to yours. They are a variant of you.   If invaders come to your home town, let's talk again, but until then remember that the shape of the squiggle on a map isn't worth killing for and isn't worth dying for.
294	295	Persuasive	Yes please start sooner rather than later to prevent more genocide and crimes against humanity.   Just recently, we have seen the woman abductor of children on a plane a while ago. Arrest her and put her into trial immediately, they need to see people punished to make them think that they can't just do anything now. All the evidence is in the video, this is a case that can be closed immediately.
290	291	Informational	Looking on google maps, this doesn't seem to affect Russia whatsoever.  The west side of China is simply connecting to Kyrgyzstand, with which it shares a border.  The line then connects to an existing line already in Uzbekistan.  This is nowhere even close to Russia. The giant country of Kazakhstan lies north of all this, after which is Russia.  What does Russia even have anything to do with this?  Might as well say it bypasses India.
76	77	Informational	and apparently Russia helping to Tajikistan to invade Kyrgyzstan
158	159	Inquiry	So what rail gauge will they use?
219	220	Persuasive	Garbage article
71	72	Persuasive	Average Azerbaijanis write in Twitter they'd not only kill Armenians but cut them into pieces and feed them to wolves. Sincerely the Aliyevs should be arrested for indoctrinating such hateful behaviour for their poor people.
853	854	Persuasive	"Oh, now they have ""fears"". Sleeping in their warm beds, while their ""malchiki"" were busy gang rapping, killing and stealing did not affected them. But then ""malchiki"" were denazified. Oh-uh, time to be afraid."
957	958	Persuasive	The only thing I'm worried about, is the fact they obviously think this war is going to last more than two and half years, poor people.
195	196	Support/Disapproval	Fuck yeah! I'm an American that's worked with many Swedes, they're lovely people. They deserve the best we have to give.  Also fuck putin.
564	565	Informational	"This is the best tl;dr I could make, [original](https://www.reuters.com/world/asia-pacific/powerful-earthquake-hits-southeast-taiwan-2022-09-18/) reduced by 77%. (I'm a bot) ***** &gt; TAIPEI, Sept 18 - A 6.8 magnitude earthquake hit the sparsely populated southeastern part of Taiwan on Sunday, the island&amp;#039;s weather bureau said, causing damage including derailed train carriages, and sparking tsunami warnings.  &gt; The U.S. Tsunami Warning Centre issued a warning in Taiwan after the tremor.  &gt; Japan&amp;#039;s weather agency issued a warning for tsunami waves of 1 metre for part of Okinawa prefecture following the earthquake.   ***** [**Extended Summary**](http://np.reddit.com/r/autotldr/comments/xhaoue/powerful_earthquake_hits_southeast_taiwan_tsunami/) | [FAQ](http://np.reddit.com/r/autotldr/comments/31b9fm/faq_autotldr_bot/ ""Version 2.02, ~669621 tl;drs so far."") | [Feedback](http://np.reddit.com/message/compose?to=%23autotldr ""PM's and comments are monitored, constructive feedback is welcome."") | *Top* *keywords*: **Taiwan**^#1 **weather**^#2 **quake**^#3 **tsunami**^#4 **magnitude**^#5"
966	967	Humorous	Women be shopping amiright?
939	940	Humorous	World in the beginning of 2020: hug the chinese!
703	704	Informational	In the end, it could lead to the suspension of the 21 billion euros ($21.3 billion) for Hungary in the EU budget.
750	751	Informational	"This is the best tl;dr I could make, [original](https://yle.fi/news/3-12626182) reduced by 95%. (I'm a bot) ***** &gt; Even before moving anti-aircraft missiles from St Petersburg, Russia appears to have moved missiles to the front from bases located closer to Ukraine and from areas considered less important than St Petersburg.  &gt; In its war against Ukraine, Russia has hardly had to use anti-aircraft missiles for their actual purpose, which is destroying missiles, aircraft or helicopters, because there has been little air combat over Ukraine.  &gt; Although Russia is struggling to produce enough new missiles for its war on Ukraine, it still has enough of the newer S-400 anti-aircraft missiles to export.   ***** [**Extended Summary**](http://np.reddit.com/r/autotldr/comments/xhbp0d/russia_moves_missiles_from_st_petersburg_to/) | [FAQ](http://np.reddit.com/r/autotldr/comments/31b9fm/faq_autotldr_bot/ ""Version 2.02, ~669626 tl;drs so far."") | [Feedback](http://np.reddit.com/message/compose?to=%23autotldr ""PM's and comments are monitored, constructive feedback is welcome."") | *Top* *keywords*: **missile**^#1 **anti-aircraft**^#2 **Russia**^#3 **equipment**^#4 **Ukraine**^#5"
110	111	Persuasive	Just follow the Minsk agreement and recognise the autonomy of LPR and DPR and we can all be done with it.
198	199	Support/Disapproval	As they should. Fuck America and its allies.
325	326	Inquiry	Are these being sold to Ukraine or donated?
239	240	Humorous	I have some great ideas if you're struggling to figure out how...
696	697	Inquiry	What's the deal with the AI generated pictures on this website?
279	280	Informational	I have written about years that Nord Stream 1 &amp; 2, especially 2, was a bad project with huge risks. Germany knew it, but they were blinded by easy money from thieves. That's sad; life and our corrupt politicians and money that makes people like they are :( At least, let's hope now we make wise decisions and finally stand up against these bullies and corrupt politicians.
789	790	Support/Disapproval	Tell that to the piece of shit FIFA!
671	672	Persuasive	Peace with Russia can only happen if Russia gets demilitarized.
557	558	Persuasive	Armenia having closer ties to US would be splendid. Azeri can finally stop invading and killing.
705	706	Humorous	I guess this means the Russians don't consider NATO that much of a threat to them
323	324	Informational	&gt;Today was the anniversary of the 1939 Soviet invasion of Poland. The Second World War began with a Nazi-Soviet alliance. It is illegal to say so in Russia. In Germany, where people are free to reflect upon this, it would not be a bad idea to do so.  https://twitter.com/timothydsnyder/status/1571351845242638336
420	421	Persuasive	You can move a whole lot at one time on a ship to any country on the planet by sea. You have less fixed infrastructure to maintain. Plus ships have the lowest emissions per ton of freight. Yes they are the most climate friendly method of transporting goods right now.
905	906	Support/Disapproval	Lesssss gooooo we re getting f-35s wooooooo can't wait to see them in action hahahaha
371	372	Persuasive	If they really wanted to help, they'd help rebuild Ukraine's industry after the war and let them produce the howitzer under a permissive license.
949	950	Persuasive	I could imagine Europeans voting for more immigration controls, but I could also imagine immigrants (who are mostly conservative themselves) voting for right wing parties also. The left wing might tolerate them more, but it's possible that being for lgbt rights, women's rights, right to express uncomfortable opinions, secularism, etc might just be too much for some immigrants.
710	711	Informational	The war crossed the border a long time ago.
594	595	Inquiry	You mean there's others?
872	873	Informational	The day after tomorrow
893	894	Persuasive	The world is waiting for another fuk up after Putin's failed war.  Once the attack starts they need to be ready to lose their Navy and Jets attacking people who have everything to lose and will not back down. I wonder if the world will need to step in to protect large necessary companies such as TSMC.
453	454	Humorous	&gt;“The potential of cylindrical batteries to result in acute surgical emergencies should not be underestimated,” the report stated.  Starts ingesting 9V's instead.
964	965	Persuasive	Shades of Zimmerman.  Anyway, seems like the only person in Ukraine that should be speaking on the matter in a time of war would be Zelensky. Imo.
833	834	Humorous	I mean, just don't have any gay butt sex and you should be fine for the most part.
486	487	Persuasive	Time to arm Ukraine with nuclear weapons.
709	710	Support/Disapproval	#girlpower
186	187	Support/Disapproval	The fuck does Mexico know about ridding oneself from the corrupt and deadly tentacles pushing to destroy their country, rule of law, and society from the inside?
36	37	Humorous	So how soon will the us get the Baja peninsula addition
367	368	Support/Disapproval	Sanction mexico. Fuck them
95	96	Persuasive	Yeah,  probably not the greatest idea to rush in an re-populate just yet. Lots of danger still exists.
199	200	Support/Disapproval	I will gladly try to survive the winter without heating if that's what it takes for Europe to stand up to this old prick.
841	842	Persuasive	CCP really fucked themselves with zero covid policy which they imposed to the world. Lets not forget millions are still in lockdown in China because their government can't acknowledge their mistakes.   Hope they wont do the same with monkeypox.
441	442	Informational	Cyberdyne model 4
857	858	Persuasive	Has anybody here actually looked at any evidence and unequivocally proven that it's not true? No? So why call it conspiracy theory and not just regular allegation?   Because it's popular to take a stance of superiority against conspiracy theorists?   Unfortunately, satanic ritual abuse is a real thing, and if any of you did your homework properly before assuming you know what's right and wrong simply by your magically 100% correct intuition, you'd already know that.   There are real people suffering because of this, and think how they must feel when people call what happened to them conspiracy theory without even looking into it for themself.   You owe these people an apology.   1.https://youtu.be/Qdjy5QX5gfk  2. https://youtu.be/c2ioRBNriG8  3. https://youtu.be/Rt4a9ie5MGk
850	851	Informational	It clearly says in the article that Ukraine hasn't officially said anything  So it's it really Ukraine says if it's one guy on Twitter
821	822	Persuasive	Mexico going to the dark side? The last thing they should want is a fractured/weakened USA which might end up with a Putin-sequence approach to its southern neighbor.
299	300	Informational	Much of the assistance to Afghanistan was not military but paying salaries, covering their national budget, and running government programs. Same potential for waste and fraud.
159	160	Humorous	Lol China is all bye bye Russia
918	919	Persuasive	And then get out of NATO at last. No one needs you there.
114	115	Informational	No better way to ruin Russo-Indian relations than to flood India with obnoxious Russian tourist. Seriously every country that caters to Russian tourists hates their guts and only does it for the money. I remember one story about a fight at a Turkish hotel between Russian and Polish tourists where the hotel staff joined in on the side of the Poles.
704	705	Informational	"Spain sent 5 transport planes with ammunition for large-caliber artillery systems to Ukraine   ""These deliveries are example of determined &amp;constant support of 🇺🇦 ppl by 🇪🇸 for long time,"" 🇪🇸Defense Minister Margarita Robles said at airfield, 🇺🇦Gen Staff reports.  https://twitter.com/EuromaidanPress/status/1571411823408078850?t=bd7RmSIyFadjP1A2skXzgA&amp;s=19"
155	156	Support/Disapproval	Fuck Putin.  Slava Ukraini.
118	119	Humorous	Someone watched Top Gun II  and got inspired
575	576	Humorous	I am championing brown issues when on MY throne. So take that Charles.
273	274	Persuasive	As an Australian I'm rather embarrassed that we haven't yet reopened our Kyiv Embassy. Many other countries have long since reopened their embassies and as always we are behind the pack. In this case it also looks cowardly.
669	670	Persuasive	*Putin wants to commit some atrocities in Ukraine and is manufacturing the pretext.
448	449	Inquiry	Why is 55 the highest number reported?!?!
623	624	Informational	The Pacific Tsunami Warning Center now reports that any tsunami threat potentially posed by the Taiwan event has ended  https://www.tsunami.gov/events/PHEB/2022/09/18/22261001/2/WEPA40/WEPA40.txt
105	106	Humorous	So anyway, Ukraine started blasting...
153	154	Persuasive	Africa has been bought by China and Russia. No idea why he even went to US, except to try his luck with shaking the bowl for some money. SA stuck in rolling blackouts, more than half their power plants are broken down. They spent millions defending corrupt politicians, Zuma is still out, Africa going to Africa yo. Let them eat cake.
806	807	Inquiry	Wouldn't Poland just block the vote? Anyone more informed could elaborate on this?
103	104	Persuasive	They'll regret it.
147	148	Informational	Lol, the article is misleading
881	882	Humorous	Danger danger, high voltage!
627	628	Persuasive	No not BRICS. But maybe a basket of the world's major currencies. I've heard some talk of that in the future. Like a baket containing some dollars, euros, yuans, yens, rupees and a couple others serving as a reserve.   Not rubles though. Who trusts rubles? Not a major currency anyway.
407	408	Support/Disapproval	Let alaska process its own gas holy heck
166	167	Persuasive	Several people said the Queen would not approve of the law if she were alive.  maybe several people should mind they own.
528	529	Humorous	Great. Now that that number is out, people will know how many they need to beat that record.
612	613	Humorous	Matrix is confused.
44	45	Support/Disapproval	Mexico should know better
842	843	Humorous	Don't worry Russia it's just a training excercise. They'll go back home in a few weeks.
606	607	Humorous	On the bright side, she was never in the position of not being able to charge her mobile phone, just not sure where her charging port is located.
271	272	Persuasive	Everyone called how he spoke crazy 30 years ago but he managed his estates much more sustainably than almost all of us. Time proved him visionary.
916	917	Inquiry	Regroup with what?!
181	182	Informational	Oooh. I see patterns from 1987 here. Dow crashed nearly 22% on Black Monday October 19, 1987 after that summer's Plaza Accord established a plan to purposely weaken the US dollar against the European and Asian currencies so US companies could compete. It was bloodbath.
119	120	Persuasive	"Not surprising something this brain dead comes out of López's  mouth. It seems that he has to one up his moronic statements; that of course will be defended by his lackeys and his cult members online.       And to think people on this sub thought of this moron as a ""[Mexican](https://www.reddit.com/r/worldnews/comments/8ver9u/mexico_election_leftist_amlo_set_for_historic/e1nktl0/)   [Bernie""](https://www.reddit.com/r/worldnews/comments/8ver9u/mexico_election_leftist_amlo_set_for_historic/e1n3op9/)"
756	757	Humorous	Oh fun. I'm a foreigner in China. I'm going to amuse myself by trying to shake hands with people all week.
628	629	Humorous	That's not how Elektra got her super power.
364	365	Persuasive	As an Aussie with a couple ex-Russian friends, I think we should continue to allow tourist in a limited capacity. It gives them a better chance to see what is wrong with their own government by comparison with our current government. Although I don't think this approach has been working in Europe enough to outweigh the costs, but it seems that if there are a limited number of tourist they will mingle more with the local population. Hmm I suppose my Russian friends didn't come here as tourists, so not sure if tourist have the same effect. Also my friends may not be like your standard Russian's as they hate hanging out with Russian's here (although they still hate most of American culture).    The only costs to allowing tourists seems to be is not showing solidarity with Ukraine and not penalising Russian Civilian's for not uprising against Putin. Uprisings are not easy work, especially when half of your country has been brainwashed.
617	618	Persuasive	Watching this war unfold is like watching a MMA match. Ukraine looks like its in deep shit and on its back and russian artillery is doing a ground and pound then, boom ukraine slips the arm bar and boom another win
350	351	Persuasive	Will arrive in time for the battle of the Ural Mountains then.
673	674	Persuasive	Any deal that doesn't involve Russia leaving all the occupied territory can't be accepted. Russia is actively committing genocide and ethnic cleansing in those areas. It should be mandatory to visit the mass graves in Izyum for these representatives that still side with Russia.
813	814	Support/Disapproval	So Mexico has chosen to side with Russia.  Maybe we should sanction them as well. Disgusting.
463	464	Humorous	Swallow (2019)
217	218	Informational	"He must have learnt this from Winnie when he last met him in Beijing during the Olympics.  For those interested, Google ""Chinese last warning""."
657	658	Informational	Video about the russian missile strikes on Kharkiv by United24. 500 apartment buildings were destroyed. 150 thousand people lost their homes. About 1 million residents continue to live in the city.   https://youtu.be/OVbPazdIepI
348	349	Support/Disapproval	I am at a loss for words...
533	534	Humorous	Holy shit. This thread is 50 comics in training practicing their punchlines.
21	22	Humorous	Top Ten Anime betrayals.
771	772	Informational	[Here's the live report](https://youtube.com/watch?v=zBcG5tOURuM&amp;feature=share&amp;utm_source=EKLEiJECCKjOmKnC5IiRIQ)
587	588	Support/Disapproval	Zelenskyy in cry baby mode again.
940	941	Inquiry	So they died from COVID?
992	993	Informational	"&gt;Sherman's March to the Sea (also known as the Savannah campaign or simply Sherman's March) was a military campaign of the American Civil War conducted through Georgia from November 15 until December 21, 1864, by William Tecumseh Sherman, major general of the Union Army.       &gt;   &gt;The campaign began with Sherman's troops leaving the captured city of Atlanta on November 15 and ended with the capture of the port of Savannah on December 21.       &gt;   &gt;His forces followed a ""scorched earth"" policy, destroying military targets as well as industry, infrastructure, and civilian property and persons, disrupting the Confederacy's economy and transportation networks.       &gt;   &gt;The operation debilitated the Confederacy and helped lead to its eventual surrender.       &gt;   &gt;Sherman's decision to operate deep within enemy territory without supply lines was unusual for its time, and the campaign is taught by some historians as an early example of modern warfare or total war.   &gt;   &gt;[https://en.wikipedia.org/wiki/Sherman%27s\_March\_to\_the\_Sea](https://en.wikipedia.org/wiki/Sherman%27s_March_to_the_Sea)"
670	671	Informational	So Mexico has fallen into the Contrarianism as a political movement trap. The disease du jour. Russia made a huge investment that might yet pay off if we don't fight against it. The problem is that it requires no intellectual ability and no agenda. Just, we zig when they zag. What the opposite of your thing is, that's our thing. You like democracy. We think it's corrupt. You like human rights? We reject your conventions. You like regulations? We deregulate. You have a plan? We hate it! But you don't even know what it is! Doesn't matter, we're the party of nothing. We are the anti-you.
742	743	Humorous	Tribute to fucking idiot news which spams me despite being unsubscribed!
960	961	Persuasive	The serfs are cowering, why don't you spray more Zs on your buildings?
392	393	Informational	"This is the best tl;dr I could make, [original](https://www.theguardian.com/world/2022/sep/17/eu-calls-for-war-crimes-tribunal-after-mass-graves-found-in-ukraine) reduced by 84%. (I'm a bot) ***** &gt; The EU presidency has called for the establishment of an international tribunal for war crimes after new mass graves were found in Ukraine.  &gt; The EU is &amp;quot;Deeply shocked&amp;quot; at the discovery by Ukrainian officials of mass graves in the recaptured city of Izium, the bloc&amp;#039;s foreign policy chief Josep Borrell said on Friday.  &gt; &amp;quot;This inhuman behaviour by the Russian forces, in total disregard of international humanitarian law and the Geneva conventions, must stop immediately.On Thursday, EU chief Ursula von der Leyen said she wanted Russian president Vladimir Putin to face the international criminal court over war crimes in Ukraine.In Washington, US president Joe Biden warned his Russian counterpart Vladimir Putin against using chemical or tactical nuclear weapons after serious losses in his war in Ukraine.&amp;quot;Don&amp;#039;t.   ***** [**Extended Summary**](http://np.reddit.com/r/autotldr/comments/xh9onp/eu_calls_for_war_crimes_tribunal_after_mass/) | [FAQ](http://np.reddit.com/r/autotldr/comments/31b9fm/faq_autotldr_bot/ ""Version 2.02, ~669608 tl;drs so far."") | [Feedback](http://np.reddit.com/message/compose?to=%23autotldr ""PM's and comments are monitored, constructive feedback is welcome."") | *Top* *keywords*: **Russian**^#1 **Ukrainian**^#2 **war**^#3 **torture**^#4 **ads**^#5"
57	58	Persuasive	The cold war tactics in here are insane, with many angles.   Armenia wants to be in US sphere, but is stuck in Russian sphere because they got screwed by previous leaders.   Iran wants to stay connected to Armenia on the southern border, because Armenia is their connect on the silk road (iirc) and they connect to the EU through Armenia and don't have to deal with Azer/Turkey.   Azer/Turkey want pan turkism to fully connect and finalize their genocide against armenians, while cozying up with Russia.   Russia gets an underground backchannel with Azeri/Turkey, while not trying to bother that relationship by supporting Armenia, after putting in shitty situation after shitty situation back to the days of the ussr.   MY BIGGEST tinfoil in all this is that the US/Iran need Armenia to stay as is (with that southern border connected) because talks of the nuclear deal are heating up.   We saw confirmed military shipments from Israel to Baku today, because Israel surely wants to screw Iran over and support Azerbaijan and Iran confirmed Israel is using Azerbaijan territory to spy.
981	982	Humorous	I hope covid 9 is a tipo, not another virus from China
633	634	Support/Disapproval	Once in Ukraine they will make lovely HiMars targets
862	863	Persuasive	"EU democracy/freedom be like ""You can have your own opinion. On second thought... No you can't """
374	375	Humorous	If I remember right she liked the idea of soldiers in burn pits. She looked like Mr Burns from the Simpsons https://youtube.com/shorts/XCU5o8tFnXQ?feature=share
416	417	Humorous	there are two wolves inside of you. one throws batteries into the ocean. the other eats them.
765	766	Inquiry	Is this now the newest fashion trend among authoritarians: need to run a war of aggression to get proper dictator creds?
127	128	Support/Disapproval	AMLO is corrupt AF
431	432	Humorous	I think the weirder thing about this is the phrase milked has been used to describe the removal process  Also remember the batteries go in the boyfriend not the person.
351	352	Humorous	Dear Britain, please re-colonize Egypt and end this madness.
326	327	Persuasive	The sooner they hack/disable these the better - Iran will pay for supporting Russia, I'm not going to be feeling particularly sorry for them under the circumstances. Everyone chooses their side.
45	46	Support/Disapproval	Can we just hang on a sec quick.    Mexico is attempting to broker a peace here?  I like that.  Be the change you want to see Mexico 👍
652	653	Support/Disapproval	Russia is counting on the EU's support to wane during the cold winter with no fuel oil. This is the first time I'm rooting for global warming
721	722	Inquiry	Wonder if the recent statements from India have something to do with their oil storage capacity being reached
62	63	Persuasive	
498	499	Humorous	Still patiently waiting for the aliens to invade next
658	659	Inquiry	Was she from Florida?
832	833	Informational	&gt; Satellite images obtained by Yle indicate that Russia has been moving a large number of anti-aircraft missiles toward Ukraine, including from as far away as St. Petersburg, one of the most crucial areas for Russian air defence.  Russia really must be running out of missiles if they are moving them away from crucial areas for their domestic air defense.
867	868	Humorous	Sure there were some positives
701	702	Informational	Mexico has already let so many foreign Russian agents in so that they can prepare. Remember Ted Cruz going to Mexico and meeting one.  Texas governor Abbott has made Mexico side with Russia as Abbott keeps threatening them so its almost like they feel they have to side with Russia. Waiting for them to announce they have let Russia have a base there
214	215	Humorous	....My brain saw 'Nord' and filled in 'VPN' after it while rapidly scrolling, had to re-read that one.
